{
  "id": "wave-5-no-towers-leaks-1",
  "layer": "integration",
  "doc": "docs/game-design/maps-and-waves.md",
  "given": { "new_match": true, "map": 1, "seed": 1 },
  "when": {
    "send_wave": 5,
    "tick_until": "no_monsters_or_game_over",
    "max_ms": 120000
  },
  "then": {
    "monsters_leaked": 1,
    "monsters_alive": 0,
    "hp": 95,
    "outcome": "playing",
    "pause": false,
    "wave_button": "sendNext"
  }
}
