{
  "id": "wave-10-spawns-9-air-bees",
  "layer": "integration",
  "doc": "docs/game-design/maps-and-waves.md",
  "given": { "new_match": true, "map": 1, "seed": 1 },
  "when": { "send_wave": 10, "tick_ms": 5000 },
  "then": {
    "wave": 10,
    "monsters_alive": 9,
    "monsters_leaked": 0,
    "monsters": [
      { "type": "bee", "hp": 320, "air": true },
      { "type": "bee", "hp": 320, "air": true },
      { "type": "bee", "hp": 320, "air": true },
      { "type": "bee", "hp": 320, "air": true },
      { "type": "bee", "hp": 320, "air": true },
      { "type": "bee", "hp": 320, "air": true },
      { "type": "bee", "hp": 320, "air": true },
      { "type": "bee", "hp": 320, "air": true },
      { "type": "bee", "hp": 320, "air": true }
    ]
  }
}
