{
  "id": "board-15x15-portals-camera",
  "layer": "unit",
  "doc": "docs/game-design/placement-and-pathfinding.md",
  "given": { "new_match": true, "map": 1 },
  "when": {},
  "then": {
    "grid_rows": 15,
    "grid_cols": 15,
    "tile_size": 1,
    "camera_elevation": 38,
    "portal_left_rows": [4, 5, 6, 7, 8, 9],
    "portal_right_col": 14
  }
}
